{
  "$schema": "../../schemas/v1/menu.schema.json",
  "id": "ubuntu-baseline",
  "title": "Ubuntu workstation provisions",
  "selection": "multi",
  "default": [],
  "options": [
    { "id": "terminal", "label": "Terminal", "description": "Choose a terminal preference.", "next": "file-managers" },
    { "id": "file-managers", "label": "File managers", "description": "Choose optional file managers.", "next": "editors" },
    { "id": "editors", "label": "Editors", "description": "Choose terminal editors.", "next": "browsers" },
    { "id": "browsers", "label": "Browsers", "description": "Choose browser delivery sources.", "next": "tiling" },
    { "id": "tiling", "label": "GNOME tiling", "description": "Choose at most one managed extension.", "next": "speech" },
    { "id": "speech", "label": "Offline speech-to-text", "description": "Choose an offline dictation application.", "next": "agents" },
    { "id": "agents", "label": "AI command-line agents", "description": "Choose one or more agents.", "next": "toolchains" },
    { "id": "toolchains", "label": "Development toolchains", "description": "Choose mise-managed toolchains.", "next": "confirm" },
    { "id": "confirm", "label": "Review and confirm", "description": "Review the queue before installation." }
  ]
}
