{
  "$schema": "../../schemas/v1/menu.schema.json",
  "id": "speech",
  "title": "Offline speech-to-text",
  "selection": "single",
  "default": "none",
  "options": [
    {
      "id": "none",
      "label": "None",
      "packageIds": []
    },
    {
      "id": "voxtype",
      "label": "Voxtype",
      "packageIds": [
        "voxtype"
      ]
    },
    {
      "id": "vocalinux",
      "label": "Vocalinux",
      "packageIds": [
        "vocalinux"
      ]
    },
    {
      "id": "speech-note",
      "label": "Speech Note",
      "packageIds": [
        "speech-note"
      ]
    },
    {
      "id": "voquill",
      "label": "Voquill",
      "packageIds": [
        "voquill"
      ]
    }
  ]
}
