{
  "$schema": "../../schemas/v1/menu.schema.json",
  "id": "toolchains",
  "title": "Development toolchains",
  "selection": "multi",
  "default": [],
  "options": [
    {
      "id": "nodejs",
      "label": "Node.js LTS",
      "packageIds": [
        "nodejs"
      ]
    },
    {
      "id": "python",
      "label": "Python",
      "packageIds": [
        "python"
      ]
    },
    {
      "id": "rust",
      "label": "Rust",
      "packageIds": [
        "rust"
      ]
    },
    {
      "id": "go",
      "label": "Go",
      "packageIds": [
        "go"
      ]
    },
    {
      "id": "java",
      "label": "Java",
      "packageIds": [
        "java"
      ]
    }
  ]
}
